sample_id,text,image_path,cognitive_load_label,linguistic_complexity_expert_1,linguistic_complexity_expert_2,formula_density_expert_1,formula_density_expert_2,knowledge_abstractness_expert_1,knowledge_abstractness_expert_2,structural_disorganization_expert_1,structural_disorganization_expert_2,table_complexity_expert_1,table_complexity_expert_2
137,"2.2.7 Process Model. The business process is a series of interrelated tasks, activities, or steps performed in a coordinated manner within an organization to achieve a specific business goal. The business process model can be encapsulated within a framework of business process hierarchies. These hierarchies visually illustrate the outcome of breaking down complex processes, a method known as process decomposition. This decomposition is carried out until it reaches the elementary business process (EBP), which is a fundamental and indivisible activity within a business that is not further subdivided into smaller processes (i.e., the smallest unit of business activity). Figure 2.12 illustrates an example of business process modeling for creating an order.Figure 2.12 This flowchart outlines the business process model for creating an order, checking availability, shipping, and payments. (attribution: Copyright Rice University, OpenStax, under CC BY 4.0 license)",/dataset/images/Figure 2.12.jpeg,3.7,6,6,3,3,6,6,7,7,4,4
138,"EBPs possess distinct characteristics that make them noteworthy in the context of business operations. They are considered significant and candidates for in-depth analysis. EBPs are typically associated with the actions of a single user, emphasizing a focused responsibility within the organization. Furthermore, these processes may encompass both manual and automated activities, reflecting the diverse nature of contemporary business workflows. User involvement in EBPs is concentrated at a specific point in time, streamlining the temporal aspect of these activities. The preservation of crucial business distinctions between processes ensures clarity and coherence. Finally, EBPs aim to leave the conceptual entity model in a consistent state, contributing to data integrity and maintaining a reliable representation of the organization’s entities and relationships where the entity model represents the various objects or concepts and their relationships within a system. A process map displays the order of chosen processes from the process hierarchies, highlighting their connection to the roles responsible for executing them. A business process hierarchy organizes a company’s activities from broad, general processes down to specific tasks, making it easier to manage and improve how the business operates. Figure 2.13 illustrates a high-level business process hierarchy that could be used for any manufacturing business process.Figure 2.13 The trading business process hierarchy includes activities such as customer management, product development, quality control, order fulfillment, and customer payments. (attribution: Copyright Rice University, OpenStax, under CC BY 4.0 license)",/dataset/images/Figure 2.13.jpeg,4.7,3,4,5,5,6,6,5,5,5,5
139,"Process map diagrams illustrate the order of chosen processes from the process hierarchies, focusing on their connection to the roles responsible for executing them. The process maps specifically highlight key processes that hold particular business importance. Although every process featured in a process map is also included in the business process hierarchy, not all processes in the hierarchy are depicted in the process maps. Process flow diagrams can depict various elements, such as the business events triggering a process, outcomes of completing a process, the processes themselves, the sequence of process steps, interruptions in the process flow, possibilities for repetition, choices, exclusivity among processes, and any additional notes. Figure 2.14 illustrates a process map diagram for an order to cash business process.Figure 2.14 The order to cash business process flows from order management through product fulfillment and payment. (attribution: Copyright Rice University, OpenStax, under CC BY 4.0 license)",/dataset/images/Figure 2.14.jpeg,4.1,6,6,6,6,4,4,5,6,5,5
140,"Figure 2.15 illustrates the process of managing orders within a business. It begins with order management, where orders are received and verified for accuracy. Next is credit management, which assesses the customer’s credit to ensure they can fulfill payment requirements. The process then moves to fulfillment, where the order is prepared and shipped. Then, during payment, the customer is invoiced and payment is processed. Invoicing is a detailed part of this step, where an invoice is generated and sent to the customer. The final stage is reporting, where the business generates reports on sales and financial transactions. This process ends once all steps are completed, ensuring each order is handled efficiently from start to finish.Figure 2.15 This sample trading business model represents a process map diagram for the enter order process. (attribution: Copyright Rice University, OpenStax, under CC BY 4.0 license)",/dataset/images/Figure 2.15.jpeg,3.5,6,6,2,2,3,4,4,4,3,3
141,"2.2. 8 Application Architecture Model. The application architecture is a subset of the enterprise solution architecture that includes a process to architect and design the application architecture as well as the actual application architecture model, which represents the content of the application architecture. Application architecture helps organizations decide how to invest in new software and systems. It makes sure that any new software being looked at, designed, or put into use can work well with the systems the organization already has. This includes brand-new software, updates to old software, making old software better, and buying and updating software packages. Figure 2.16 illustrates a conceptual application architecture model of the sample trading business model that was introduced earlier in this section. The goal of a conceptual application architecture is to demonstrate how members of the organization interact with the application architecture from different locations when invoking business processes. This example illustrates three distinct offices accommodating a diverse range of users, including management, trading, IT, and others.Figure 2.16 A conceptual trading application architecture moves through various levels, including users, functions, enterprise services, and third-party systems. (attribution: Copyright Rice University, OpenStax, under CC BY 4.0 license)",/dataset/images/Figure 2.16.jpeg,4.4,5,5,5,4,6,6,5,5,6,6
142,"Figure 2.17 takes the conceptual trading application architecture a bit further and describes what one of the alternative application architectures may look like at the logical level. The goal of the logical application architecture is to identify the various functional blocks within the architecture without getting into the details of how they connect with and/or use each other.Figure 2.17 The logical trading application architecture illustrates each function block for the processing of customer orders. (attribution: Copyright Rice University, OpenStax, under CC BY 4.0 license)",/dataset/images/Figure 2.17.jpeg,3.4,3,3,5,5,2,2,5,5,7,6
143,"Figure 2.18 is a simplified view of the logical trading application architecture model that provides callouts to explain what the various functions are meant to accomplish. It is good practice to document the functions in that way. It is also good practice to provide an additional diagram (not included here) that includes callouts identifying the actual third-party technologies that are used to implement the various functions.Figure 2.18 This logical trading application architecture includes function callouts that identify the technologies used for this process. (attribution: Copyright Rice University, OpenStax, under CC BY 4.0 license)",/dataset/images/Figure 2.18.jpeg,3.4,5,5,4,4,3,3,4,4,1,5
144,"2.2.9 Data Architecture Model. A data architecture model is a conceptual framework that outlines how an organization structures, organizes, and manages its data assets. Data architecture forms a component of the broader enterprise solution architecture. It encompasses the design process for both information and actual data architecture models, representing the content within the data architecture. This framework aids organizations in strategically planning investments in data management solutions and associated systems. The evaluated, designed, and delivered data management solutions must seamlessly coexist with established ones, managing newly developed databases as well as legacy database extensions. In general, information can be extracted from raw data, knowledge can be gleaned from information, and wisdom can be obtained from knowledge. Most enterprises refer to the relationship between data, information, knowledge, and wisdom as the pyramid of knowledge. A wealth of additional information related to data management and the pyramid of knowledge is provided in Chapter 8 Data Management. Information modeling is the process used to describe the metadata necessary to understand the data, processes, and rules that are relevant to the enterprise, as illustrated in Figure 2.19.Figure 2.19 Examining and learning from data is integral to an organization’s success, as outlined in this role of information modeling figure. (attribution: Copyright Rice University, OpenStax, under CC BY 4.0 license)",/dataset/images/Figure 2.19.jpeg,4.6,4,4,7,7,7,7,7,6,5,5
145,"In the collaborative process of data modeling, IT and business stakeholders establish a shared understanding of essential business terms, known as entities, which typically end up being represented as tables that contain data in a relational database management system. This involves defining the attributes that characterize these terms and establishing the relationships between them. The capability to uphold and document the data model is integral to an organization’s capacity to address varied data acquisition needs across critical business projects. In essence, a well-maintained data model serves as a foundational element for ensuring coherence and effectiveness in managing diverse data requirements.Figure 2.20 is an example of an enterprise-level conceptual data architecture for an insurance company. The goal of the enterprise conceptual data architecture is to illustrate the various types of data repositories and the way data is collected and managed within the enterprise.Figure 2.20 The enterprise conceptual data architecture for a fictitious insurance company highlights the different ways in which data is handled and managed. (attribution: Copyright Rice University, OpenStax, under CC BY 4.0 license)",/dataset/images/Figure 2.20.jpeg,4.3,6,6,7,7,4,4,5,5,8,6
146,"Figure 2.21 illustrates a possible physical architecture for the sample trading business model that was introduced earlier in this section. This diagram depicts the layout of the actual hardware components that make up the infrastructure of the trading solution. It also delineates where the functional blocks of the application architecture are physically deployed. Note that this physical technology architecture leverages the layout and components of the enterprise application architecture illustrated previously at the conceptual level.Figure 2.21 The physical trading application architecture highlights the use of hardware to meet the organization’s goals. (attribution: Copyright Rice University, OpenStax, under CC BY 4.0 license)",/dataset/images/Figure 2.21.jpeg,3.8,7,5,4,4,5,5,5,6,3,3
147,"An alternative physical application architecture for the trading solution is shown in Figure 2.22. The diagram does not delineate where the functional blocks of the application architecture are physically deployed.Figure 2.22 This alternative physical trading application architecture outlines possible changes from the existing web solution. (attribution: Copyright Rice University, OpenStax, under CC BY 4.0 license)",/dataset/images/Figure 2.22.jpeg,5.4,4,5,6,6,8,8,8,7,8,7
148,"2.2.9 Breadth of Applicability of Models. Figure 2.23 illustrates the key dimensions for representing and categorizing architecture models, accompanying diagrams, and related patterns. These architecture domains align with the TOGAF standard, as discussed earlier. The diagram also illustrates the levels of abstraction to characterize various architectural models. Additionally, it introduces the architecture scope as another dimension, classifying the models’ breadth of applicability at the enterprise, portfolio, or project level. The architecture scope is the extent and boundaries within which architectural considerations, decisions, and solutions apply.Figure 2.23 TOGAF architectural dimensions include various levels of abstraction. (attribution: Copyright Rice University, OpenStax, under CC BY 4.0 license)",/dataset/images/Figure 2.23.jpeg,5.3,6,6,7,7,5,5,5,8,8,8
149,"2.2.3 Leveraging Architectural Similarities and Applying Patterns. A solutions continuum is a strategy where existing solutions, components, or patterns are leveraged and adapted for use in different contexts. Figure 2.24 illustrates the TOGAF model of reuse that is referred to as the solutions continuum. As mentioned earlier, TOGAF does not provide a prescriptive approach to creating and/or managing a catalog of patterns. However, various pattern repositories are available on the Internet and the adaptive design technique can be used to avoid having to reinvent the wheel when architectural patterns and related component implementations exist and can be customized and assembled with new components. More information on this topic is provided in Chapter 10 Enterprise and Solution Architectures Management.Figure 2.24 This TOGAF solutions continuum illustrates how each architecture guides and supports the others. (attribution: Copyright Rice University, OpenStax, under CC BY 4.0 license)",/dataset/images/Figure 2.24.jpeg,4.9,9,5,6,5,6,6,8,8,5,5
150,"As illustrated in Figure 2.25, the TOGAF solutions continuum offers a limited set of dimensions. It serves as a guideline, and The Open Group allows interested parties to enhance the model by incorporating additional dimensions that are relevant to their specific needs.Figure 2.25 The TOGAF architecture continuum can suggest extensions but may only be able to focus on one aspect at a time. (attribution: Copyright Rice University, OpenStax, under CC BY 4.0 license)",/dataset/images/Figure 2.25.jpeg,4.4,4,4,6,6,7,7,4,4,5,5
151,"2.2.4 Responsive Web 2.0 Business Solutions. World Wide Web Consortium (W3C) is an international community that develops guidelines to ensure the long-term growth and accessibility of the World Wide Web. Web 2.0 is the second generation of the World Wide Web when we shift from static web pages to dynamic content. Web 3.0 is the third generation of the World Wide Web and represents a vision for the future of the Internet characterized by advanced technologies. Most modern websites rely on the Web 2.0 architectural model set forth by W3C. A sample logical application architecture model is illustrated in Figure 2.26.Figure 2.26 The logical application architecture of Microsoft Azure-hosted web applications allows for responsive web and mobile solutions for users. (attribution: Copyright Rice University, OpenStax, under CC BY 4.0 license)",/dataset/images/Figure 2.26.jpeg,4.7,5,5,8,8,5,5,6,6,8,7
152,"2.3.5 Native Mobile Business Solutions. A web application (web app) is a software application that is accessed and interacted with through a web browser over the Internet. Many web-based solutions leverage the inherent capabilities of mobile devices, offering web apps tailored for various types of phones in addition to responsive websites. Numerous frameworks exist to facilitate the development of native web apps, streamlining the process of creating applications that can run seamlessly on different mobile platforms. These frameworks often provide a unified and efficient approach to building cross-platform mobile applications, ensuring a consistent user experience across various devices.. In certain frameworks and development environments, React Native UI component libraries can be leveraged to, port web apps to mobile devices. Examples include React Native support for Android apps using the Android Studio (Android Studio provides a comprehensive environment for developing, testing, and debugging Android apps) or iPhone web app using XCode IDEs (Xcode is an integrated development environment [IDE] developed by Apple for macOS that offers a suite of tools for building software for Apple platforms, including macOS, iOS, watchOS, and tvOS). Figure 2.27 illustrates the logical application architecture of mobile web apps that use React Native. In addition to these capabilities, the adaptive design reuse approach may be used to create the custom part of the native web app. More information related to the development of native web app solutions is provided in Chapter 9 Software Engineering, Chapter 10 Enterprise and Solution Architectures Management, and Chapter 11 Web Applications Development.Figure 2.27 The logical application architecture of React Native mobile web apps shows the back-end processes that allow both Android and IOS customers to use the same application. (attribution: Copyright Rice University, OpenStax, under CC BY 4.0 license)",/dataset/images/Figure 2.27.jpeg,6.2,9,8,8,8,8,8,10,10,9,8
153,"2.3.6 Web 3.0 Business Solutions.The secure and transparent way of recording transactions that uses a chain of blocks, each storing a list of encrypted transactions is called blockchain. Once a block is full, it is linked to the previous one, forming a chain. Blockchain technology decentralizes processing to ensure the integrity of transactions across multiple computer nodes. This ensures that no single computer node gets assigned to processing transactions repeatedly, thereby preventing possible fraudulent modifications of transactions. A smart contract is an automated agreement written in code that runs on blockchain technology. They enforce contract terms automatically when specific conditions are met, removing the need for intermediaries and ensuring security. The use of blockchain smart contracts within web applications is becoming more popular. The logical application architecture model in Figure 2.28 illustrates how this is made possible by creating hybrid Web 2.0 websites that interact with Web 3.0 smart contracts.Figure 2.28 The flowchart show the logical application architecture of a Web 2.0 and Web 3.0 Website. (attribution: Copyright Rice University, OpenStax, under CC BY 4.0 license)",/dataset/images/Figure 2.28.jpeg,5.2,5,5,6,6,8,8,5,5,7,7
154,"2.3.7 Cloud-Native Business Solutions. A way of building software by breaking it into small, independent pieces where each piece, or service, does a specific job and works on its own is called microservices. A large number of businesses have been migrating their legacy business solutions to the cloud to take advantage of microservices that are designed around specific business functions and can be deployed independently using automated deployment systems. Figure 2.29 illustrates how secure, managed, and monetized APIs that are critical for a digital enterprise can be created by leveraging a combination of API-led integration frameworks and cloud-native technologies. The use of such frameworks and technologies helps streamline the migration of legacy business solutions. The process of migrating legacy business solutions means upgrading or replacing old systems with newer, more efficient ones. In addition to these capabilities, the adaptive design reuse approach may be used to create the custom part of the cloud-native applications. More information related to the development of cloud-native solutions is provided in Chapter 9 Software Engineering, Chapter 10 Enterprise and Solution Architectures Management, and Chapter 12 Cloud-Native Applications Development.Figure 2.29 The cloud-native application architecture view of a digital enterprise shows both client-side and server-side processes through each layer. (attribution: Copyright Rice University, OpenStax, under CC BY 4.0 license)",/dataset/images/Figure 2.29.jpeg,5.2,7,7,7,7,6,7,7,7,6,6
155,"2.3.8 Innovative Cloud Mashups.Figure 2.30 and Figure 2.31 illustrate models of solutions that are used today to support a variety of mobile health (MHealth), body area networks (BANs), emotions monitoring, and social media applications. In addition to the capabilities provided by the Big Clouds, the adaptive design reuse approach may be used to create the custom part of these hybrid solutions. Google Maps and Zillow are prime examples of applications that utilize location-based data to deliver valuable services. A GPS device identifies a user’s location, and that information flows through the central network. Apps then display this data in a user-friendly manner, connecting users with real-time geographic information in Google Maps or housing market details in Zillow. The integration of GPS with other IoT systems allows for the seamless presentation of customized, location-specific content to enhance the user experience. More information related to the development of web solutions is provided in Chapter 9 Software Engineering, Chapter 10 Enterprise and Solution Architectures Management, and Chapter 13 Hybrid Multicloud Digital Solutions Development.Figure 2.30 IoT devices use sensors, applications, and connectivity to interact, collect, and exchange data. (attribution: Copyright Rice University, OpenStax, under CC BY 4.0 license)",/dataset/images/Figure 2.30.jpeg,4.2,6,6,2,3,6,6,6,6,3,3
156,"Internet of Things (IoT) refers to the network of physical devices embedded with sensors, software, and connectivity, enabling them to collect and exchange data. The process of examining, processing, and extracting valuable insights from large datasets is called big data analytics. Developing algorithms that enable computers to learn from data and make decisions without explicit programming is called machine learning. This is made possible by creating mashups of platform services provided by various public cloud vendors to gain access to these disruptive technologies.Figure 2.31 This diagram depicts an architecture of a body area network. (credit: modification of Body Area Network by Jtel /Wikimedia Commons, Public Domain)",/dataset/images/Figure 2.31.jpeg,3.9,3,3,5,6,6,6,5,5,4,4
157,"3 Chapter Outline. 3.1 Introduction to Data Structures and Algorithms.3.2 Algorithm Design and Discovery. 3.3 Formal Properties of Algorithms. 3.4 Algorithmic Paradigms. 3.5 Sample Algorithms by Problem. 3.6 Computer Science TheoryOnline maps help people navigate a rapidly changing world. It was not long ago that maps were on paper and that knowledge came from non-digital, trusted sources. In this chapter, we will study how computer scientists design and analyze the foundational structures behind many of today’s technologies. Data structures and algorithms are not only foundational to map apps, but also enable an amazing variety of other technologies too. From self-driving cars to inventory management to simulating the movement of galaxies to transferring data between computers—all these applications use data structures and algorithms to efficiently organize and process large amounts of information.Figure 3.1 Online mapping applications represent places, locations, and map data while providing functionality to look around, search for places, and get navigation directions. The right combination of data structures to manage collections of places, locations, and map data along with efficient search and navigation algorithms will help optimize the experience of users trying to find their way through the map and will also make optimal use of computing resources. (attribution: Copyright Rice University, OpenStax, under CC BY 4.0 license; data source: OpenStreetMap under Open Database License; attribution: Copyright Rice University, OpenStax, under CC BY 4.0 license)",/dataset/images/Figure 3.1.jpeg,5.1,5,5,7,8,5,5,5,5,6,6
158,"Among the different types of universal data structures, computer scientists have found it helpful to categorize data structures according to their functionality without considering their specific representation. An abstract data type (ADT) consists of all data structures that share common functionality but differ in specific representation.Common abstract data types for complex data follow, and list and set types are shown in Figure 3.2. We will discuss each abstract data type in more detail together with their data structure implementations.Figure 3.2 Lists and sets are common abstract data types used to represent complex data and can be in the form of integers or string data. (attribution: Copyright Rice University, OpenStax, under CC BY 4.0 license)",/dataset/images/Figure 3.2.jpeg,6.3,10,10,6,5,8,9,9,8,6,6
